{
  "version": "1.0",
  "catalogVersion": "1.0.0",
  "name": "서비스 소개",
  "theme": "botanical",
  "palette": "forest",
  "mode": "light",
  "shell": "topbar",
  "typography": "sans",
  "density": "comfortable",
  "radius": "soft",
  "tree": {
    "type": "page",
    "children": [
      {
        "type": "page-header",
        "title": "좋은 도구는, 생각할 틈을 만듭니다.",
        "description": "복잡한 일상에서 중요한 것에 집중할 수 있도록."
      },
      {
        "type": "hero",
        "variant": "split",
        "title": "작은 선택이 모여\n당신다운 작업으로.",
        "body": "검토한 재료를 조립해 나만의 흐름을 만드세요. 시작은 가볍게, 쌓이는 가치는 오래도록.",
        "action": {
          "label": "자세히 알아보기",
          "href": "#main",
          "variant": "primary"
        }
      },
      {
        "type": "grid",
        "columns": "three",
        "children": [
          {
            "type": "card",
            "title": "시작은 명확하게",
            "body": "흩어진 정보를 한곳에 모아 방향을 정합니다.",
            "meta": "01 · 정리"
          },
          {
            "type": "card",
            "title": "과정은 유연하게",
            "body": "상황에 맞는 방식을 골라 작업을 이어갑니다.",
            "meta": "02 · 연결"
          },
          {
            "type": "card",
            "title": "결과는 오래도록",
            "body": "다음 작업에서도 쓸 수 있게 남깁니다.",
            "meta": "03 · 축적"
          }
        ]
      },
      {
        "type": "notice",
        "tone": "info",
        "title": "당신의 방식으로 시작하세요.",
        "body": "완성된 틀 안에서도 다양한 선택이 가능합니다."
      }
    ]
  }
}
