{
  "version": "1.0",
  "catalogVersion": "1.0.0",
  "name": "프로젝트 현황",
  "theme": "workspace",
  "palette": "ocean",
  "mode": "light",
  "shell": "sidebar",
  "typography": "sans",
  "density": "comfortable",
  "radius": "soft",
  "tree": {
    "type": "page",
    "children": [
      {
        "type": "page-header",
        "title": "다음 결정을 위한 한눈.",
        "description": "오늘의 흐름을 읽고, 중요한 일에 집중하세요."
      },
      {
        "type": "grid",
        "columns": "three",
        "children": [
          {
            "type": "metric",
            "label": "진행 중 프로젝트",
            "value": "12",
            "detail": "이번 주 시작한 프로젝트 3개"
          },
          {
            "type": "metric",
            "label": "완료한 작업",
            "value": "84",
            "detail": "지난주보다 12개 더 완료"
          },
          {
            "type": "metric",
            "label": "다음 마일스톤",
            "value": "10. 24.",
            "detail": "디자인 리뷰 · 오후 2시"
          }
        ]
      },
      {
        "type": "section",
        "title": "지금 집중할 일",
        "children": [
          {
            "type": "grid",
            "columns": "two",
            "children": [
              {
                "type": "card",
                "title": "브랜드의 새로운 언어",
                "body": "제품의 성격을 살리는 표현과 규칙을 함께 정리합니다.",
                "meta": "디자인 · 진행 중"
              },
              {
                "type": "card",
                "title": "작은 개선의 기록",
                "body": "사용자가 망설이는 순간을 찾아 하나씩 다듬습니다.",
                "meta": "리서치 · 이번 주"
              }
            ]
          }
        ]
      },
      {
        "type": "table",
        "title": "최근 작업",
        "caption": "프로젝트별 최근 변경과 담당 현황",
        "columns": [
          "작업",
          "담당",
          "상태"
        ],
        "rows": [
          [
            "조립 규약 정리",
            "김다선",
            "완료"
          ],
          [
            "팔레트 후보 검토",
            "디자인팀",
            "진행"
          ],
          [
            "다음 릴리스 준비",
            "개발팀",
            "대기"
          ]
        ],
        "state": "ready"
      }
    ]
  }
}
